{
  "contract_version": "1.0.0",
  "run_id": "11111111-1111-4111-8111-111111111111",
  "state": "WORKER_QUEUED",
  "created_at": "2026-08-22T16:00:00Z",
  "updated_at": "2026-08-22T16:00:01Z",
  "current_task_id": "22222222-2222-4222-8222-222222222222",
  "links": {
    "self": "http://localhost:8000/api/v1/runs/11111111-1111-4111-8111-111111111111",
    "events": "http://localhost:8000/api/v1/runs/11111111-1111-4111-8111-111111111111/events"
  }
}
